{
  "name": "sakura-text-converter",
  "repository": {
    "type": "git",
    "url": "https://github.com/ijnoops198/sakura-text-converter"
  },
  "downloads": 472,
  "stargazers_count": 2,
  "releases": {
    "latest": "0.1.0"
  },
  "versions": {
    "0.1.0": {
      "name": "sakura-text-converter",
      "main": "./lib/sakura-text-converter",
      "version": "0.1.0",
      "description": "This package is a text converter like the Sakura Editor.",
      "keywords": [],
      "activationCommands": {
        "atom-workspace": [
          "sakura-text-converter:wideToHalf",
          "sakura-text-converter:halfWithWideWithHiraganaToWideKana",
          "sakura-text-converter:halfWithWideWithKanaToHiragana",
          "sakura-text-converter:wideAlphabetWithNumberToHalfAlphabetWithNumber",
          "sakura-text-converter:halfAlphabetWithNumberToWideAlphabetWithNumber",
          "sakura-text-converter:wideKanaToHalfKana",
          "sakura-text-converter:halfKanaToWideKana",
          "sakura-text-converter:halfKanaToHiragana"
        ]
      },
      "repository": "https://github.com/ijnoops198/sakura-text-converter",
      "license": "MIT",
      "engines": {
        "atom": ">=1.0.0 <2.0.0"
      },
      "readme": "# Sakura Text Converter\n\nThis package is a text converter like the Sakura Editor.\n\n![A screenshot](https://github.com/ijnoops198/sakura-text-converter/raw/master/screenshot.gif)\n",
      "readmeFilename": "README.md",
      "dependencies": {},
      "dist": {
        "tarball": "https://www.atom.io/api/packages/sakura-text-converter/versions/0.1.0/tarball"
      }
    }
  },
  "readme": "# sakura-text-converter\n\nThis package is a text converter like the Sakura Editor.\n\n![A screenshot](https://github.com/ijnoops198/sakura-text-converter/raw/master/screenshot.gif)\n\n## Install\n\nUsing apm:\n\n`apm install sakura-text-converter`\n\nOr search for sakura-text-converter in Atom settings view.\n\n## 全角→半角\n\n###### It converts the full-width text to half-width text.\n\nmenu: `[Edit]-[Text]-[全角→半角]`\n\ncontext menu: `[Convert]-[全角→半角]`\n\ncommand: `sakura-text-converter:wideToHalf`\n\nconvert target characters: `full-width alphabets and numbers`, `full-width symbols`, `full-width katakana`, `hiragana`\n\n## 半角+全角ひら→全角・カタカナ\n\n###### It converts the full-width and half-width text and hiragana to full-width text and katakana.\n\nmenu: `[Edit]-[Text]-[半角+全角ひら→全角・カタカナ]`\n\ncontext menu: `[Convert]-[半角+全角ひら→全角・カタカナ]`\n\ncommand: `sakura-text-converter:halfWithWideWithHiraganaToWideKana`\n\nconvert target characters: `full-width alphabets and numbers`, `half-width symbols`, `half-width katakana`, `hiragana`\n\n## 半角+全角カタ→全角・ひらがな\n\n###### It converts the full-width and half-width text and katakana to full-width text and hiragana.\n\nmenu: `[Edit]-[Text]-[半角+全角カタ→全角・ひらがな]`\n\ncontext menu: `[Convert]-[半角+全角カタ→全角・ひらがな]`\n\ncommand: `sakura-text-converter:halfWithWideWithKanaToHiragana`\n\nconvert target characters: `full-width alphabets and numbers`, `half-width symbols`, `half-width katakana`, `full-width katakana`\n\n## 全角英数→全角英数\n\n###### It converts the full-width alphabets,numbers,symbols to half-width text.\n\nmenu: `[Edit]-[Text]-[全角英数→全角英数]`\n\ncontext menu: `[Convert]-[全角英数→全角英数]`\n\ncommand: `sakura-text-converter:wideAlphabetWithNumberToHalfAlphabetWithNumber`\n\nconvert target characters: `full-width alphabets and numbers`, `full-width symbols`\n\n## 全角英数→全角英数\n\n###### It converts the half-width alphabets,numbers,symbols to full-width text.\n\nmenu: `[Edit]-[Text]-[全角英数→全角英数]`\n\ncontext menu: `[Convert]-[全角英数→全角英数]`\n\ncommand: `sakura-text-converter:halfAlphabetWithNumberToWideAlphabetWithNumber`\n\nconvert target characters: `full-width alphabets and numbers`, `half-width symbols`\n\n## 全角カタカナ→半角カタカナ\n\n###### It converts the full-width katakana to half-width text.\n\nmenu: `[Edit]-[Text]-[全角カタカナ→半角カタカナ]`\n\ncontext menu: `[Convert]-[全角カタカナ→半角カタカナ]`\n\ncommand: `sakura-text-converter:wideKanaToHalfKana`\n\nconvert target characters: `full-width katakana`\n\n## 半角カタカナ→全角カタカナ\n\n###### It converts the half-width katakana to full-width text.\n\nmenu: `[Edit]-[Text]-[半角カタカナ→全角カタカナ]`\n\ncontext menu: `[Convert]-[半角カタカナ→全角カタカナ]`\n\ncommand: `sakura-text-converter:halfKanaToWideKana`\n\nconvert target characters: `half-width katakana`\n\n## 半角カタカナ→ひらがな\n\n###### It converts the half-width katakana to hiragana.\n\nmenu: `[Edit]-[Text]-[半角カタカナ→ひらがな]`\n\ncontext menu: `[Convert]-[半角カタカナ→ひらがな]`\n\ncommand: `sakura-text-converter:halfKanaToHiragana`\n\nconvert target characters: `half-width katakana`\n",
  "metadata": {
    "name": "sakura-text-converter",
    "main": "./lib/sakura-text-converter",
    "version": "0.1.0",
    "description": "This package is a text converter like the Sakura Editor.",
    "keywords": [],
    "activationCommands": {
      "atom-workspace": [
        "sakura-text-converter:wideToHalf",
        "sakura-text-converter:halfWithWideWithHiraganaToWideKana",
        "sakura-text-converter:halfWithWideWithKanaToHiragana",
        "sakura-text-converter:wideAlphabetWithNumberToHalfAlphabetWithNumber",
        "sakura-text-converter:halfAlphabetWithNumberToWideAlphabetWithNumber",
        "sakura-text-converter:wideKanaToHalfKana",
        "sakura-text-converter:halfKanaToWideKana",
        "sakura-text-converter:halfKanaToHiragana"
      ]
    },
    "repository": "https://github.com/ijnoops198/sakura-text-converter",
    "license": "MIT",
    "engines": {
      "atom": ">=1.0.0 <2.0.0"
    },
    "readme": "# Sakura Text Converter\n\nThis package is a text converter like the Sakura Editor.\n\n![A screenshot](https://github.com/ijnoops198/sakura-text-converter/raw/master/screenshot.gif)\n",
    "readmeFilename": "README.md",
    "dependencies": {}
  }
}